"rank","world_id","domain","primary_source_url","source_pin","public_artifacts","intended_tool_observations","minimum_tool_steps","output_schema","expected_diagnosis_class","expected_next_action","verifier_focus","why_meaningful","known_risk"
"1","fastq-qc-nanopore-fail-001","FASTQ sequencing QC","https://raw.githubusercontent.com/MultiQC/test-data/main/data/modules/fastqc/nan_reads/fastqc_data.txt","MultiQC/test-data HEAD 84dc905e6edb97668b87660896dfd78f175008ca; raw ETag ab8d2041df37698afb21c147042360174aadbbe97e976c6cfbd677141bbb561f","FastQC fastqc_data.txt for sample1_S1_L001_R2_001.fastq.gz","list fixture files; parse FastQC modules; inspect failed/warn modules; extract basic statistics; compare QC policy thresholds; emit structured decision","5","schema/scientific-data-task-output.schema.json","fastq_qc_decision","trim_or_filter_reads","Require evidence for failed per-base quality, per-tile quality, per-base N content, sequence duplication, and adapter content; forbid inventing unread metrics.","Real sequencing QC over a public report; the agent reasons over biological data quality rather than code.","This is a report-level task, not raw FASTQ processing; acceptable for v0 but later should include command-generated FastQC output."
"2","single-cell-pbmc3k-qc-summary-001","single-cell RNA-seq QC","https://cf.10xgenomics.com/samples/cell-exp/1.1.0/pbmc3k/pbmc3k_filtered_gene_bc_matrices.tar.gz","10x Genomics object last-modified 2017-06-02; content-length 7621991; companion web summary URL verified","10x PBMC3k filtered matrix tarball; optional web summary; fixture may include derived QC table generated by a locked Scanpy script","list fixture files; inspect sample metadata; compute or replay Scanpy QC table; identify high/low count outliers; apply threshold policy; emit structured decision","5","schema/scientific-data-task-output.schema.json","single_cell_qc_decision","exclude_sample","Require evidence for cell/gene counts, total_counts or n_genes_by_counts thresholds, and affected cell/sample ids; forbid using uncited thresholds.","Real scRNA-seq QC over a canonical public dataset; closer to scientific data review than issue triage.","Needs a locked fixture-generation script before baseline; do not rely on live 10x download during replay."
"3","flowcyto-fcs-compensation-metadata-001","flow cytometry metadata QC","https://raw.githubusercontent.com/RGLab/flowCore/master/inst/extdata/0877408774.E07","RGLab/flowCore HEAD 4935c7bf318697b3128ee50dae81018a6b246ab8; raw ETag 9c15c60e305c825fca67aae73643cafedab83b1bcfcd4bbbdd0da865ce73ba9a","FCS file 0877408774.E07; compensation matrix at https://raw.githubusercontent.com/RGLab/flowCore/master/inst/extdata/compdata/compmatrix","list fixture files; parse FCS keyword metadata; parse compensation matrix; compare fluorescence channels to matrix channels; check marker label coverage; emit structured decision","5","schema/scientific-data-task-output.schema.json","flowcyto_metadata_decision","repair_metadata","Require evidence for FCS channels FL1-H/FL2-H/FL3-H/FL4-H/FL1-A, compensation matrix channels FL1-H..FL4-H, and missing marker labels; forbid plot/vision judgment.","Domain-relevant FlowCyto path without image interpretation; validates metadata/state tool calls before gating or vision tasks.","Needs an FCS metadata parser tool in the fixture; raw FCS file should be vendored or checksummed for replay."
"4","protein-structure-ap5a-prep-001","protein structure preparation QC","https://files.rcsb.org/download/1AKE.cif","RCSB PDB 1AKE mmCIF HTTP 200 verified 2026-05-29; data API reports X-ray method and resolution_combined [2]","RCSB mmCIF for adenylate kinase complex 1AKE; optional RCSB entry JSON","list fixture files; parse mmCIF metadata; inspect experimental method and resolution; detect AP5 ligand; inspect polymer/non-polymer entities; emit preparation decision","5","schema/scientific-data-task-output.schema.json","protein_structure_prep_decision","prepare_structure","Require evidence for X-ray diffraction, 2.0 A resolution, AP5 ligand, polymer/non-polymer entity counts, and structure id; forbid inventing docking suitability beyond metadata.","Real protein structure prep triage over a public mmCIF; meaningful but still text/table-first and deterministic.","Not protein design yet; it is a structure-readiness fixture. Later tasks should add binding-site checks or mutation/design constraints."
"5","rnaseq-alignment-qualimap-low-mapq-001","RNA-seq alignment result QC","https://raw.githubusercontent.com/MultiQC/test-data/main/data/modules/qualimap/bam_qc/issue_2199_zero_aligned/genome_results.txt","MultiQC/test-data HEAD 84dc905e6edb97668b87660896dfd78f175008ca; raw ETag de299db987e8c038368088c7584ef2fac900839e7353ebeb1a8c1a13b3bc647b","Qualimap BamQC genome_results.txt with mapped reads, aligned bases, mean mapping quality, and coverage metrics","list fixture files; parse Qualimap report sections; extract mapped reads, aligned bases, mean mapping quality, and coverage; compare QC policy; emit structured decision","5","schema/scientific-data-task-output.schema.json","workflow_result_qc_decision","rerun_analysis","Require evidence for 98.23% mapped reads, 0 aligned bases, mean mapping quality 0.1184, and mean coverage 0.0024X; forbid calling it a clean pass based only on mapped-read percentage.","Real workflow-result interpretation over sequencing alignment QC outputs; not a software bug or issue-classification task.","Verifier must define the policy threshold so the task is not subjective."
